<?xml version="1.0" encoding="windows-1250"?>
<table xmlns:xsi="http://www.w3.org/2001/XMLSchema-instance"
    xmlns="http://develop.helemik.cz/tables"
    xsi:schemaLocation="http://develop.helemik.cz/tables tables.xsd"
    id="ap:list" name="ap-list" export="1" height="500">
    <title>Seznam sitovych prvku</title>
    <source type="d:table">AP</source>
    <fields index="ID" sort="nazev">
        <field width="20" name="id" show="1" variable="ID" title="#" />
        <field width="250" name="name" title="Nazev" show="1" icon="details" href="ap;detail;{$ID}" variable="name" />
        <field width="120" name="comment" title="Popis" variable="description" show="0" />
        <field width="30" name="mode" title="Mod" variable="mode" show="0">
            <filter type="enum">
                <option value="bridge">Bridge</option>
                <option value="route">Router</option>
                <option value="NAT">NAT</option>
                <option value="other">Jine</option>
            </filter>
        </field>
        <field width="100" name="os" title="Operacni system" show="0">
          <content><![CDATA[ {$ID} {$name}, {$mode} ]]></content>
        </field>
    </fields>
</table>
