<?xml version="1.0" encoding="windows-1250"?>
<table xmlns:xsi="http://www.w3.org/2001/XMLSchema-instance"
    xmlns="http://develop.helemik.cz/tables"
    xsi:schemaLocation="http://develop.helemik.cz/tables tables.xsd"
    id="ap-ips" export="1">
	<params>
		<param name="ap" type="int" title="Sitovy prvek" sql="SELECT ID, Nazev FROM AP" />
	</params>
	<title>IP adresy</title>
	<source type="d:model" model="AP" id="ap" property="APIP" />
	<fields index="ID">
		<field name="id" variable="ID" title="#" show="1"/>
		<field name="ip" title="IP" show="1">
			<content>{$ip}/{$netmask}</content>
		</field>
		<field name="interface" variable="interface" title="Rozhrani" show="1"/>
		<field name="comment" variable="comment" title="Popis" show="1"/>
		<field name="flags" title="Priznaky" show="1">
			<content>
				{= $not_real ? 'Tato IP zde fyzicky neni' : ''}
				{= $no_people ? 'Neprirazovat zakazniky' : ''}
			</content>
		</field>
	</fields>
	<edit type="editform" form="APIP">
        <default name="AP" variable="ap" />
    </edit>
	<menu>
		<item title="Ping" onclick="ServisWeb.ping(row.IP);" />
		<item title="Otevrit admin" onclick="window.open('http://' + row.IP + '/', '_blank');" />
	</menu>
</table>
